{
  "verdict": "BLOCK",
  "reason": "no_audit_yet",
  "audit_date": null,
  "sapptest_version": "0.1.0",
  "findings_open": 0,
  "sev_counts": { "sev1": 0, "sev2": 0, "sev3": 0, "sev4": 0 },
  "blocking": [],
  "notes": "No audit has run. /ship will refuse until /audit produces a real verdict, OR the user explicitly overrides."
}
